{
  "run_id": "run-2026-09-05-0003",
  "brief_version": "1",
  "brief": {
    "brief_id": "brief-2026-09-05-003",
    "version": 1,
    "user_problem": "Test missing challenge case.",
    "intended_use": "Error coverage.",
    "objective": "Flag missing major claims challenges.",
    "research_questions": [
      {
        "question_id": "q1",
        "text": "What is the primary claim?"
      }
    ],
    "definitions": {},
    "scope": "Single fixture.",
    "constraints": [
      "No external calls"
    ],
    "output": "Validation report.",
    "success_criteria": [
      "High importance claim has a challenge"
    ],
    "assumptions": [
      "This is synthetic."
    ],
    "unresolved_questions": []
  },
  "sources": [
    {
      "source_id": "source-1",
      "title": "Controlled Retrieval Benchmarks",
      "author_or_org": "Research Board",
      "url_or_identifier": "https://example.edu/retrieval-benchmarks",
      "publication_date": "2025-01-04",
      "retrieved_at": "2026-09-05T00:00:00Z",
      "publisher": "Example University",
      "source_type": "peer-reviewed",
      "independence_group": "independent"
    }
  ],
  "evidence": [
    {
      "evidence_id": "e1",
      "source_id": "source-1",
      "locator": "Appendix A",
      "excerpt_or_faithful_summary": "Strong claim with high importance.",
      "extracted_data": {
        "study_type": "test"
      }
    }
  ],
  "claims": [
    {
      "claim_id": "claim-1",
      "exact_text": "LLM retrieval reduces average onboarding time.",
      "claim_type": "INFERENCE",
      "importance": 0.85,
      "question_id": "q1",
      "supporting_evidence_ids": ["e1"],
      "contradicting_evidence_ids": []
    }
  ],
  "challenges": [],
  "reviews": [
    {
      "claim_id": "claim-1",
      "entailment_check": "supported",
      "source_quality": "high",
      "corroboration": "mixed",
      "contradiction_status": "none",
      "disposition": "Approved",
      "confidence_rationale": "Single source only.",
      "reviewer_notes": "Used for negative test."
    }
  ],
  "agent_log": ["orchestrator", "researcher", "reviewer"],
  "query_log": ["q1"]
}
